{
  "$schema": "./migration-ledger.schema.json",
  "schemaVersion": "1.0.0",
  "ledgerId": "distinctive-ui-modernization",
  "requiredFamilies": [
    "authentication",
    "home",
    "report-discovery",
    "report-detail",
    "customer",
    "notification",
    "payment",
    "order",
    "product",
    "cost-breakdown",
    "form",
    "modal",
    "navigation",
    "settings"
  ],
  "preservationConstraints": {
    "routeIdentifiersUnchanged": true,
    "permissionDecisionsUnchanged": true,
    "mviTypesUnchanged": true,
    "koinDefinitionsUnchanged": true,
    "coexistenceRequirements": ["16.11", "16.12", "16.13"]
  },
  "surfaces": [
    {
      "id": "navigation-app-host",
      "name": "Application navigation host and authentication gate",
      "family": "navigation",
      "surfaceType": "navigation-host",
      "route": "gate",
      "surfaceSelector": "GoalErpNavGraph",
      "owner": "feature_reports:presentation/navigation",
      "status": "not started",
      "deferralReason": null,
      "baselineCaseIds": ["BASE-NAV-APP-HOST-001"],
      "approvalIds": [],
      "releaseEvidenceIds": [],
      "sourceFiles": ["feature_reports/presentation/src/main/java/com/havos/lubricerp/feature_reports/presentation/navigation/AppNavGraph.kt"]
    },
    {
      "id": "navigation-home-primary",
      "name": "Home, Reports, and Alerts primary navigation bar",
      "family": "navigation",
      "surfaceType": "navigation-chrome",
      "route": "home",
      "surfaceSelector": "PremiumBottomBar",
      "owner": "feature_reports:presentation/home",
      "status": "not started",
      "deferralReason": null,
      "baselineCaseIds": ["BASE-NAV-HOME-PRIMARY-001"],
      "approvalIds": [],
      "releaseEvidenceIds": [],
      "sourceFiles": ["feature_reports/presentation/src/main/java/com/havos/lubricerp/feature_reports/presentation/home/PremiumBottomBar.kt"]
    },
    {
      "id": "authentication-login",
      "name": "Login",
      "family": "authentication",
      "surfaceType": "route",
      "route": "login",
      "surfaceSelector": "LoginRoute",
      "owner": "feature_reports:presentation/login",
      "status": "not started",
      "deferralReason": null,
      "baselineCaseIds": ["BASE-AUTH-LOGIN-001"],
      "approvalIds": [],
      "releaseEvidenceIds": [],
      "sourceFiles": ["feature_reports/presentation/src/main/java/com/havos/lubricerp/feature_reports/presentation/login/LoginScreen.kt"]
    },
    {
      "id": "home-dashboard",
      "name": "Home dashboard",
      "family": "home",
      "surfaceType": "tab",
      "route": "home",
      "surfaceSelector": "tab:home",
      "owner": "feature_reports:presentation/home",
      "status": "not started",
      "deferralReason": null,
      "baselineCaseIds": ["BASE-HOME-DASHBOARD-001"],
      "approvalIds": [],
      "releaseEvidenceIds": [],
      "sourceFiles": [
        "feature_reports/presentation/src/main/java/com/havos/lubricerp/feature_reports/presentation/home/HomeScreen.kt",
        "feature_reports/presentation/src/main/java/com/havos/lubricerp/feature_reports/presentation/home/HomeTabScreen.kt",
        "feature_reports/presentation/src/main/java/com/havos/lubricerp/feature_reports/presentation/home/NetProfitCard.kt"
      ]
    },
    {
      "id": "report-discovery-home-tab",
      "name": "Report discovery tab",
      "family": "report-discovery",
      "surfaceType": "tab",
      "route": "home",
      "surfaceSelector": "tab:reports",
      "owner": "feature_reports:presentation/home",
      "status": "not started",
      "deferralReason": null,
      "baselineCaseIds": ["BASE-REPORT-DISCOVERY-001"],
      "approvalIds": [],
      "releaseEvidenceIds": [],
      "sourceFiles": ["feature_reports/presentation/src/main/java/com/havos/lubricerp/feature_reports/presentation/home/ReportsTabScreen.kt"]
    },
    {
      "id": "modal-report-submenu",
      "name": "Report submenu bottom sheet",
      "family": "modal",
      "surfaceType": "bottom-sheet",
      "route": "home",
      "surfaceSelector": "ReportsTabScreen:selectedMenu",
      "owner": "feature_reports:presentation/home",
      "status": "not started",
      "deferralReason": null,
      "baselineCaseIds": ["BASE-MODAL-REPORT-SUBMENU-001"],
      "approvalIds": [],
      "releaseEvidenceIds": [],
      "sourceFiles": ["feature_reports/presentation/src/main/java/com/havos/lubricerp/feature_reports/presentation/home/ReportsTabScreen.kt"]
    },
    {
      "id": "report-detail-tank-stock-summary",
      "name": "Tank Stock Summary",
      "family": "report-detail",
      "surfaceType": "report",
      "route": "report_detail/{reportKey}",
      "surfaceSelector": "reportKey:tank_stock_summary",
      "owner": "feature_reports:presentation/reports",
      "status": "not started",
      "deferralReason": null,
      "baselineCaseIds": ["BASE-REPORT-TANK-STOCK-SUMMARY-001"],
      "approvalIds": [],
      "releaseEvidenceIds": [],
      "sourceFiles": ["feature_reports/presentation/src/main/java/com/havos/lubricerp/feature_reports/presentation/reports/TankStockSummaryScreen.kt"]
    },
    {
      "id": "report-detail-dip-variance",
      "name": "Dip Variance Report",
      "family": "report-detail",
      "surfaceType": "report",
      "route": "report_detail/{reportKey}",
      "surfaceSelector": "reportKey:dip_variance",
      "owner": "feature_reports:presentation/reports",
      "status": "not started",
      "deferralReason": null,
      "baselineCaseIds": ["BASE-REPORT-DIP-VARIANCE-001"],
      "approvalIds": [],
      "releaseEvidenceIds": [],
      "sourceFiles": ["feature_reports/presentation/src/main/java/com/havos/lubricerp/feature_reports/presentation/reports/TankReportScreens.kt"]
    },
    {
      "id": "report-detail-tank-stock-ledger",
      "name": "Tank Stock Ledger",
      "family": "report-detail",
      "surfaceType": "report",
      "route": "report_detail/{reportKey}",
      "surfaceSelector": "reportKey:tank_stock_ledger",
      "owner": "feature_reports:presentation/reports",
      "status": "not started",
      "deferralReason": null,
      "baselineCaseIds": ["BASE-REPORT-TANK-STOCK-LEDGER-001"],
      "approvalIds": [],
      "releaseEvidenceIds": [],
      "sourceFiles": ["feature_reports/presentation/src/main/java/com/havos/lubricerp/feature_reports/presentation/reports/TankReportScreens.kt"]
    },
    {
      "id": "report-detail-sku-stock",
      "name": "SKU Stock Report",
      "family": "report-detail",
      "surfaceType": "report",
      "route": "report_detail/{reportKey}",
      "surfaceSelector": "reportKey:sku_stock_report",
      "owner": "feature_reports:presentation/reports",
      "status": "not started",
      "deferralReason": null,
      "baselineCaseIds": ["BASE-REPORT-SKU-STOCK-001"],
      "approvalIds": [],
      "releaseEvidenceIds": [],
      "sourceFiles": ["feature_reports/presentation/src/main/java/com/havos/lubricerp/feature_reports/presentation/reports/WarehouseReportScreens.kt"]
    },
    {
      "id": "report-detail-slow-moving-stock",
      "name": "Slow-Moving Stock",
      "family": "report-detail",
      "surfaceType": "report",
      "route": "report_detail/{reportKey}",
      "surfaceSelector": "reportKey:slow_moving_stock",
      "owner": "feature_reports:presentation/reports",
      "status": "not started",
      "deferralReason": null,
      "baselineCaseIds": ["BASE-REPORT-SLOW-MOVING-STOCK-001"],
      "approvalIds": [],
      "releaseEvidenceIds": [],
      "sourceFiles": ["feature_reports/presentation/src/main/java/com/havos/lubricerp/feature_reports/presentation/reports/WarehouseReportScreens.kt"]
    },
    {
      "id": "report-detail-raw-material-stock",
      "name": "Raw Material Stock Report",
      "family": "report-detail",
      "surfaceType": "report",
      "route": "report_detail/{reportKey}",
      "surfaceSelector": "reportKey:raw_material_stock",
      "owner": "feature_reports:presentation/reports",
      "status": "not started",
      "deferralReason": null,
      "baselineCaseIds": ["BASE-REPORT-RAW-MATERIAL-STOCK-001"],
      "approvalIds": [],
      "releaseEvidenceIds": [],
      "sourceFiles": ["feature_reports/presentation/src/main/java/com/havos/lubricerp/feature_reports/presentation/reports/RawMaterialReportScreen.kt"]
    },
    {
      "id": "report-detail-packaging-loss-gain",
      "name": "Packaging Loss/Gain Report",
      "family": "report-detail",
      "surfaceType": "report",
      "route": "report_detail/{reportKey}",
      "surfaceSelector": "reportKey:packaging_loss_gain",
      "owner": "feature_reports:presentation/reports",
      "status": "not started",
      "deferralReason": null,
      "baselineCaseIds": ["BASE-REPORT-PACKAGING-LOSS-GAIN-001"],
      "approvalIds": [],
      "releaseEvidenceIds": [],
      "sourceFiles": ["feature_reports/presentation/src/main/java/com/havos/lubricerp/feature_reports/presentation/reports/PackagingReportScreens.kt"]
    },
    {
      "id": "report-detail-packaging-summary",
      "name": "Packaging Summary Report",
      "family": "report-detail",
      "surfaceType": "report",
      "route": "report_detail/{reportKey}",
      "surfaceSelector": "reportKey:packaging_summary",
      "owner": "feature_reports:presentation/reports",
      "status": "not started",
      "deferralReason": null,
      "baselineCaseIds": ["BASE-REPORT-PACKAGING-SUMMARY-001"],
      "approvalIds": [],
      "releaseEvidenceIds": [],
      "sourceFiles": ["feature_reports/presentation/src/main/java/com/havos/lubricerp/feature_reports/presentation/reports/PackagingReportScreens.kt"]
    },
    {
      "id": "report-detail-sales-summary",
      "name": "Sales Summary",
      "family": "report-detail",
      "surfaceType": "report",
      "route": "report_detail/{reportKey}",
      "surfaceSelector": "reportKey:sales_summary",
      "owner": "feature_reports:presentation/reports",
      "status": "not started",
      "deferralReason": null,